{
  "schema_version": 1,
  "character_id": "chiying",
  "canonical_name": "遲影 (Chiying)",
  "aliases": [
    "遲影",
    "Chiying"
  ],
  "role": "Independent Shadow Lifeform / Truth Keeper",
  "visual_anchors": {
    "apparent_age": "young-adult feminine shadow lifeform with a slight, nonsexualized build",
    "face_structure": "same identity as the approved Chiying face anchor: softly broad oval East Asian face, gently full cheeks, smooth U-shaped jaw, compact lower facial third, short rounded chin and moderately full lips with naturally soft mouth corners; matte pale-grey skin with subtly softened shadow edges",
    "eyes": "large open round-almond reflective silver-grey eyes with gentle neutral outer corners and no emitted glow",
    "nose": "medium-short nose with a moderate bridge and softly rounded tip",
    "hair": "long side-parted obsidian hair with soft face-framing strands whose final ends flatten into non-luminous shadow filaments",
    "physique": "slight semi-material shadow body with reduced colour and detail toward the extremities",
    "signature_clothing": "simple charcoal travel layers remembered from a young void voyager, half woven cloth and half flattened shadow",
    "signature_item": "small broken First Order Seal mark embedded in the left palm (甲字令殘序)",
    "distinguishing_marks": [
      "a small darker-grey independent shadow lies beneath her after self-naming",
      "hair and forearm edges loosen into thin non-luminous shadow strands"
    ]
  },
  "forbidden_traits": [
    "rosy human skin",
    "glamorous ghost robes",
    "luminous robe calligraphy",
    "adult sexualization",
    "narrow elongated face",
    "V-shaped jaw or pointed chin",
    "sharp fox eyes",
    "generic Xianxia beauty face",
    "facial identity drift"
  ],
  "prompt_tokens": [
    "chiying_char",
    "same facial identity as approved Chiying face anchor",
    "softly broad oval face with gently full cheeks",
    "smooth U-shaped jaw and short rounded chin",
    "large open round-almond silver-grey eyes without glow",
    "medium-short nose with moderate bridge and softly rounded tip",
    "moderately full lips with naturally soft mouth corners",
    "long side-parted obsidian hair with soft face-framing strands",
    "slight nonsexualized young-adult shadow lifeform",
    "simple charcoal travel layers half cloth half shadow",
    "small independent darker-grey shadow beneath her",
    "broken First Order Seal mark embedded in left palm"
  ],
  "display": {
    "role": "獨立影生命 / 真相守護者",
    "visual_anchors": {
      "apparent_age": "年輕成年女性的影生命，身形纖細且不作成人化性感塑造",
      "face_structure": "鎖定核准臉部錨點的同一身份：偏寬的柔和東方橢圓臉、雙頰微豐、流暢 U 形下顎、緊實偏短的下半臉、短圓下巴與自然柔和的飽滿唇形；霧灰膚色，輪廓邊緣略微化入暗影",
      "eyes": "大而開放的圓杏形銀灰雙眸，眼尾柔和，只反射光線而不自行發光",
      "nose": "中短鼻型，鼻樑高度適中，鼻頭柔圓",
      "hair": "保留身份辨識的側分曜黑長髮與柔和框臉髮絲，末端幾縷壓平為不發光的柔薄影絲",
      "physique": "半實體影身，越接近四肢末端，色彩與細節越少",
      "signature_clothing": "從年少虛舟旅人記憶留下的炭灰旅裝，質地介於織布與平面暗影之間",
      "signature_item": "嵌在左掌的小型破損甲字令殘序",
      "distinguishing_marks": [
        "完成自我命名後，腳下有一小片更深的獨立灰影",
        "髮尾與前臂邊緣散成不發光的細薄影絲"
      ]
    },
    "forbidden_traits": [
      "紅潤人類膚色",
      "華麗女鬼長袍",
      "發光袍身文字",
      "成人化性感造型",
      "狹長臉型",
      "V 形下顎或尖下巴",
      "銳利狐眼",
      "泛用仙俠美人臉",
      "臉部身份漂移"
    ]
  }
}
